标题,户型,租房方式,房屋大小,房屋朝向,楼层,区县,小区名称,地址,房租,地铁,房屋配置,房屋描述
王舍人新东站万虹广场旁精装两室家具家电齐全,2室1厅1卫,整租,65,南北,高层 / 33层,历城,田园新苑,历城工业北路 - 工业北路,1300,距离地铁R3号线王舍人站1463米,"['电视', '空调', '热水器', '洗衣机', '冰箱', '床', '沙发', '衣柜', '暖气', '宽带', '可做饭', '阳台']",1.居民素质高，生活舒适度高，2.人文环境很重要！小区配套：3.小区配套设施齐全，生活方便，健身房，影城，大型超市购物中交通便利，有车位，好停车，出门就公交站牌，多路公交车直达！交通方便：附近有8路、40路、K57路、97路、106路、313路、315路多路公交车，出行方便4.服务介绍：我是中住地产的一名资深置业顾问，对主打楼盘商圈户型、结构、配套非常熟悉。选择我，选择中住地产！我是徐焕焕，很高兴为您服务！======山东中住地产只卖房源====
可短租！解放东路 政法学院 历下大厦 浆水泉路 姚家 家具全,3室1厅1卫,整租,92,南,高层 / 6层,历下,政府宿舍(姚家),历下姚家 - 解放东路83号,1999,无,"['电视', '空调', '热水器', '洗衣机', '冰箱', '床', '沙发', '衣柜', '暖气', '宽带', '可做饭', '阳台']","1、高性价比付款方式灵活、季付、半年付、大程度方便住户，减轻租客压力2、白金地段，地铁口快捷交通。饭店、药店、水果店、各色小吃、便利店、足疗、美容美发、网吧、茶社、菜场等小型生活配套楼下醇熟配套，十分便利3、拎包入住房间均配置了大床、写字桌椅、温馨衣柜、洗衣机、24天然气热水，一应俱全，做到了真正的全装修拎包入住标准。4、配备齐全主卧：带独立卫生间，全新家具，床衣柜电脑桌家电：电视、洗衣机、厨房5、看房自由本房源真实存在，您只需要一个电话,即可带您看房,精装修,6.可入住时间：随时入"
宝世达 文亮教育 万虹广场 香溢澜庭精装主卧阳台 南向无中介,4室2厅2卫,合租 - 主卧,30,南,中层 / 32层,历城,新城香溢澜庭,"历城工业北路 - 工业北路,近开源路",700,距离地铁R3号线王舍人站833米,"['热水器', '洗衣机', '冰箱', '沙发', '宽带', '可做饭']","恒大城一期，二期，恒大公寓万象新天，4区，高尔夫花院，万卷府，理想郡，云公馆,哈弗郡，剑桥郡。香溢紫郡,澜庭.有单独的男生，或，女生宿舍。朝向楼层可供选择。价格400--1300不等我们都有房源出租,有需要随时联系,随时看房.一个电话让你不再东跑西跑./"
地铁口 2室2厅1卫 全套 徐家庄附近单位宿舍随时看房入住,2室2厅1卫,整租,84,南,中层 / 7层,高新,徐家庄,高新国际会展中心 - 凤凰路,1700,无,"['电视', '空调', '热水器', '洗衣机', '床', '沙发', '衣柜', '暖气', '宽带', '可做饭', '阳台']",1位置：高新万达广场东徐家庄附近单位宿舍适合万达附近上班人群、软件园。舜泰广场汉峪金谷、财富中心附近人群2、户型：2室2厅1卫3、配套：双人床、床头柜、衣橱、沙发、茶几、电视机电视机柜、冰箱、洗衣机、空调、整体厨房油烟机、整体卫生间热水器等全套家居家电4.有钥匙随时看房随时入住好房5、高新工业南路、奥体中路、奥体中心、高新会展中心、汉峪、齐鲁软件园高新万达广场及凤凰路周边房源都有，需要的客户可以随时联系点击我的头像可直接进入我的网络门店查看更好！
精装主卧独卫 有暖气 有空调 有厨房 无中介F 无物业费,3室2厅2卫,合租 - 主卧,28,南,中层 / 12层,高新,徐家庄,高新国际会展中心 - 凤凰路,850,无,"['热水器', '洗衣机', '冰箱', '沙发', '宽带', '可做饭']",一、房屋基本信息：1、楼盘名称：徐家庄2、房屋性质：住宅3、装修情况：精装房4、配套情况：精装厨房整体橱柜床、空调、冰箱、洗衣机、热水器等家具家电齐全，拎包即可入住6、腾房情况：房屋现在空置，干净整洁，随时入住。7、看房时间：提前联系8、不想住了可免费转租。二、小区配套：1、附近万达广场、银座超市、社区医院菜市场等生活便利。2、交通方便：小区门口有K171、BRT6、K63路等公交，可直达洪家楼、玉兰广场、王舍人、济钢等地。
舜泰广场齐鲁软件园附近一室一厅一卫精装智能公寓无中介拎包入住,1室1厅1卫,整租,35,南,共3层,高新,龙园小区(别墅),高新经十路高新段 - 凤凰路4569号,1500,无,"['电视', '空调', '热水器', '洗衣机', '冰箱', '床', '沙发', '衣柜', '暖气', '宽带', '可做饭', '阳台']",1.智能门锁，每户唯一密码，app管理自己房间。2.智能监控，24公区录像。3.智能纯净水设备，24纯净水免费喝。4.智能电表，每户一表，自己充值，充多少用多少。5.每间独立卫生间，独立24热水器洗澡方便。6.每间标配独立冰箱，洗衣机，宜家桌椅、书架、衣柜、席梦思床垫、落地灯、空调、密码门锁等。7.包水费，物业、宽带、保洁（公共区域一周一次专业保洁打扫卫生）、维修，管理费。
可短租 草山岭小区精装修次卧 带空调 临近普利广场 浪潮大厦,3室2厅2卫,合租 - 次卧,20,南,中层 / 18层,高新,草山岭西区,高新汉峪 - 经十路,750,无,"['热水器', '洗衣机', '冰箱', '沙发', '宽带', '可做饭']",1房屋位于浪潮，万科中心，舜泰广场，汉峪金谷，龙奥金座、龙奥大厦、齐鲁软件园、普利广场、华创观礼附近步行即可到达。2户型精装修，室友都是附近工作的人整体素质高爱干净整洁3房子家具、家具配套齐全每月免费定期保洁房产经纪非中介，多个房源可供您选择，有需要可以随时联系随时在线随时看房，很高兴为您服务！
绿地中心楼下  照片属实  拎包入住  无中介,3室1厅1卫,合租 - 次卧,25,北,中层 / 6层,市中,石棚街10号小区,市中经四万达 - 石棚街10号,599,无,"['热水器', '洗衣机', '冰箱', '沙发', '宽带', '可做饭']",1.全明户型：户型方正，南北通透，小区环境优美，绿化覆盖率高。2.拎包入住：家具家电齐全3.物业费超低，生活成本低4.精致装修，让您免除装修劳累之苦5.交通便利：周边的交通线路网络发达6.生活配套齐全：周边有大型超市，小吃街，休闲广场等等
紧邻汉峪金谷 舜泰广场 舜奥华府精装次卧 随时看房 拎包入住,3室2厅2卫,合租 - 次卧,28,南,中层 / 27层,高新,济高舜奥华府,高新汉峪 - 舜华南路,750,无,"['电视', '空调', '热水器', '洗衣机', '冰箱', '床', '沙发', '衣柜', '暖气', '宽带', '可做饭', '阳台']",1·房子虽是合租，但干净卫生，适合年轻人居住，是您晚上休息的理想居所；2、房子配套：床，衣橱，桌子，椅子，热水器，洗衣机，拎包入住；3、小区位置很好，周边生活配套设施齐全，银座，丁豪广场.万达广场，工、农、建、招商、兴业、民生、交通银行；4·地处中心地段，交通便利，门口即是公交站牌，周围设施设备配套完善房屋内标配：驋.鸺-驋.鑶米床、床头柜、衣橱、写字桌、椅子、壁挂式空调、宽带、实木床定期上门为您做保洁.关于房子：小区生活方便，门口超市蔬菜水果店一应俱全。周边商业发达，各大超市，银行俱全。【房源优势】小区紧邻汉峪金谷，小区紧邻汉峪金谷，公交直达玉兰广场，万科中心，金域中心，浪潮，龙奥大厦舜泰广场，奥体中心，【房源描述】次卧朝阳，独立阳台有水盆，单独洗漱，24H热水，朝阳，采光好。专业售后，专业保洁，室友好相处，家电齐全，拎包入住【我们的周边房源】舜奥华府，东城逸家，北湖小区，南湖花苑，凤凰上郡，草山岭，万科麓山，奥龙观邸，浪潮玺苑，奥林逸城，凤凰国际，汉峪新苑，南湖小区，德润天玺，均紧邻汉峪金谷，舜泰广场，龙奥大厦，玉兰广场，浪潮，万科中心，金域中心，龙奥金座，龙奥大厦附近，奥体中心附近，银丰财富广场附近【我们对租客的要求】为了为每一个租客创造更舒适的环境一，养宠物不租，二，不讲究公共卫生不租，三，吵闹不租。我们不只关注租前，更关注每一个租客的入住体验您需要的房源（合理的价格，舒适的环境，步行的距离，好相处的室友，当您有问题时随时都能出面解决的专业管家）你需要的我们已经做到
便宜单间月付无压力中海天悦府精装主次卧单间紧临美莲广场奥盛,3室2厅2卫,合租 - 次卧,18,南,低层 / 32层,高新,中海天悦府(北区),高新齐鲁软件园 - 舜风路700号,600,无,"['空调', '热水器', '洗衣机', '床', '沙发', '衣柜', '暖气', '宽带', '可做饭', '阳台']","位置优越：高新区均有合租单间卧室出租价格400到1500元左右不等，主卧独卫，次卧，小单间都有。双人床，桌椅，衣架，暖气，空调，冰箱，洗衣机等等家电齐全，24热水，无线网等等家具家电齐全，欢迎刚毕业的大学毕业生以及准备长期在济南工作的上班族入住交通便利：地处工业南路主干道南侧，路过公交车包,10.47.87，99,122.123,109,119,321,202，K160，K161，162，308，311，319，321等，出行十分方便，紧邻齐鲁软件园丁豪广场银河大厦三庆财富中铁财智省立东院舜泰广场浪潮集团美莲广场大学科技园奥盛大厦鑫盛大厦铭盛大厦万达广场"
汉峪金谷 舜泰广场 二室二厅合租 拎包入住 无中间费,2室2厅1卫,合租 - 主卧,23,南,低层 / 28层,高新,汉峪金谷金寓,"高新汉峪 - 龙奥北路,近舜华南路",600,无,"['电视', '空调', '热水器', '洗衣机', '冰箱', '床', '沙发', '衣柜', '暖气', '宽带', '可做饭', '阳台']",房源优势：1.不说装修多好，少干净卫生，清净明亮。2.不像别的房居住人多且杂，合租四间，品牌只为专属的你。3.小区，出门公交，闹中取静，成熟商圈，周边菜市场，超市，小吃街，论你是购物狂，吃货，夜猫子，技术宅都能满足。4.租客，三有不租，养宠物者不租，带老人者不租，正当职业者不租，带小孩者不租，让合租的你住的更有品质。5.公司自己的房子，不是骗人，真的不收中价费。6.服务周到，带你看遍济南商圈所有房子，相信我，成就你。7.线宽带、衣柜、大床、电脑桌、晾衣架、空调、24*热水器、暖气、冰箱、洗衣机、厨房可做饭
维尔康宿舍出租 精装修 附近维尔康肉类水产市场 随时看房,2室1厅1卫,整租,76.31,南北,中层 / 6层,历城,维尔康宿舍,"历城历城周边 - 工业北路263,268号",1399,无,"['电视', '空调', '热水器', '洗衣机', '冰箱', '床', '沙发', '衣柜', '暖气', '可做饭', '阳台']",【格局】2室1厅1卫，采光好，视野无遮挡。【价格】租金1399元/月【装修】房子居家精装，保养全新【图片为本房图片】【看房】24随时。交通：8，71，46，106，k92，k93，k55，k57路公交车大学：工会管理干部学院、济南轻工学院、济南金融学院商场：华联超市、黄台菜市场医院：山大二院、社区门诊、济钢医院邮局：中国邮政全福网点银行：工商银行、农业银行、建设银行、齐鲁银行其他：兴泉大酒店、维尔康食品公司
中铁国际城精装南次卧原户型鲁商国奥城奥体中心省立医院拎包入住,3室2厅2卫,合租 - 次卧,29,南,高层 / 21层,历下,中国铁建国际城,历下解放东路 - 奥体西路北段2666号,888,距离地铁R3号线礼耕路站582米,"['热水器', '洗衣机', '冰箱', '沙发', '宽带', '可做饭']",房子全新装修，家电有：热水器、洗衣机、空调等；家具有：床、衣柜、电脑桌、窗帘、晾衣杆等。100M光纤宽带。房间为民水民电无任何杂费后期有保障免费维修保洁。价格区间不等，（根据房间面积大小，朝向价格略有不同）详情请来电咨询。适合刚出来工作或已经工作的青年朋友。。房间干净清爽。看了你肯定满意。独门独户．安静舒适，互不打扰。要求：安静不吵闹作息规律大家出门在外相遇都是缘分都希望能相互之间考虑一下保留一点好感另有百套房源单间300-500次卧600-800.主卧900-1000，独卫1000-1400，
武警单位宿舍 三室 低楼层 空调房 2000,3室1厅1卫,整租,97,南北,低层 / 11层,高新,景苑小区,高新经十路高新段 - 经十路,2000,无,"['空调', '热水器', '洗衣机', '床', '沙发', '衣柜', '暖气', '宽带', '可做饭', '阳台']",高新区武警总队单位宿舍设施齐全电梯房双气三线齐全精装床衣橱电脑桌沙发茶几空调洗衣机热水器油烟机炉灶等小区位于经十东路与水华路，汉峪金谷舜泰广场东，近齐全软件园、美莲广场、奥盛大厦、银河大厦、万达文旅城、银座汽车等高新区乘坐115116136直达水华路站下车即是实拍图片有钥匙随时看房随时入住
景苑小区主卧带阳台全女生带厨房汉峪金谷舜泰广场直达公交车,3室2厅2卫,合租 - 主卧,32,南,高层 / 11层,高新,景苑小区,高新经十路高新段 - 经十路,650,无,"['热水器', '洗衣机', '冰箱', '沙发', '宽带', '可做饭']",房子全新装修，家电有：热水器、洗衣机、空调等；家具有：床、衣柜、电脑桌、窗帘、晾衣杆等。100M光纤宽带。房间为民水民电无任何杂费后期有保障免费维修保洁。价格区间不等，（根据房间面积大小，朝向价格略有不同）详情请来电咨询。适合刚出来工作或已经工作的青年朋友。。房间干净清爽。看了你肯定满意。独门独户．安静舒适，互不打扰。要求：安静不吵闹作息规律大家出门在外相遇都是缘分都希望能相互之间考虑一下保留一点好感另有百套房源单间300-500次卧600-800.主卧900-1000，独卫1000-1400，
景苑小区 三室 家具齐全 随时入住,3室1厅1卫,整租,97,南北,高层 / 12层,高新,景苑小区,高新经十路高新段 - 经十路,1900,无,"['热水器', '洗衣机', '冰箱', '床', '沙发', '衣柜', '暖气', '宽带', '可做饭', '阳台']",高新区武警总队单位宿舍设施齐全电梯房双气三线齐全精装床衣橱电脑桌沙发茶几洗衣机热水器油烟机炉灶等小区位于经十东路与水华路，汉峪金谷舜泰广场东，近齐全软件园、美莲广场、奥盛大厦、银河大厦、万达文旅城、银座汽车等高新区乘坐115116136直达水华路站下车即是实拍图片有钥匙随时看房随时入住
唐冶精装合租 银丰 绿地 东八区附近  家具家电齐全 可付一,3室2厅2卫,合租 - 主卧,20,南,低层 / 30层,历城,绿地城1期,"历城唐冶 - 唐冶中路,近唐冶西路",600,无,"['热水器', '洗衣机', '冰箱', '沙发', '宽带', '可做饭']",1简装3室随时看房签约入住2世纪大道南唐冶西路交通便利3小区内绿化环境良好小区附近多家超市生活便利4欢迎致电!随时看房！！！
紧挨着荣盛时代 鹊华天禧 全福大润发 可月付 干净卫生 拎包,3室2厅2卫,合租 - 主卧,22,南,中层 / 26层,历城,鹊华天禧,历城全福 - 北园大街37号,688,无,"['热水器', '洗衣机', '冰箱', '沙发', '宽带', '可做饭']",1、小区周边配套丰富，饭店，超市，生活十分便利！地理位置优越交通便利，多路公交经过家门口，附近公交车交通便捷！1、小区周边配套丰富，饭店，超市，生活十分便利！地理位置优越交通便利，多路公交经过家门口，附近公交车交通便捷！2、家里有床、衣柜，桌子等家具一应俱全3、.房源价格低廉4、.物品损坏15天之内免费上门维修5专业保洁程每星期定期检查，排除电路水路等安全隐患6、租赁期间如有各项问题，我们房管员为您排解解难协调调解备注为了保障合租的安全，所有租客都要经过验证。7、温馨提示养的、没有正当职业的、不爱干净的、大吵大闹的，为了营造干
三庆新馨家园出租精装修 附近莱钢凯旋公馆 御化嘉苑拎包入住,2室1厅1卫,整租,83.54,南北,高层 / 6层,历下,三庆新馨家园,历下康虹路 - 化纤厂路6号,1899,距离地铁R3号线花园东路站1677米,"['电视', '空调', '热水器', '洗衣机', '冰箱', '床', '沙发', '衣柜', '暖气', '可做饭', '阳台']",【格局】2室1厅1卫，采光好，视野无遮挡。【价格】租金1899元/月【装修】房子居家精装，保养全新【图片为本房图片】【看房】24随时。公交：37路、k95路线(华能路化纤厂路站)大学：山东大学山东商业职业学院商场：万隆超市、银座购物广场华信店医院：历下区人民医院、齐鲁花园医院，第三人民医院，欧亚男科医院邮局：中国邮政华龙分所银行：建设银行、工商银行、农业银行，农村信用社齐鲁银行其他：城市之光商务酒店、华诚大酒店煌庭一号娱乐会所、华信银座、小区内部配套：小区北部有双语幼儿园、大型活动会所
新出~锦绣泉城~精装两居~南北通透~家具家电齐全~领包住,2室2厅1卫,整租,98,南,低层 / 20层,历城,锦绣泉城,历城华龙路 - 华龙路999号,1850,无,"['电视', '空调', '热水器', '洗衣机', '冰箱', '床', '沙发', '衣柜', '暖气', '宽带', '可做饭', '阳台']",1.这个小区物业正规，24*物业，安全的很2、咱们小区周边有很多济南小吃，满足吃货的要求，之前我经常在这吃3、自家房子，价格低廉、房子照片都是我自己亲自拍摄的，随时看房，正规卧室，4、物品损坏24*内免费上门维修、我们有自己的维修师傅5、服每星期定期检查卫生，排除电路水路等安全隐患6、房间干净整洁、每天都会打扫卫生、希望租客能吧那当成自己的家、维护机自觉打扫卫生、7、租赁期间如有各项问题，我们客服为您排解困难协调调解温馨提示养宠物的、没有正当职业的、不爱干净的、大吵大闹的，为了营造干净、和谐、安全的居住环境，以上租客不租谢谢合作、
热租，无中介！康城花园，火车站k88，济南站大润发，宝华新区,3室2厅2卫,合租 - 主卧,21,南,中层 / 17层,天桥,康成花园,天桥堤口路 - 宝华街37号,600,无,"['热水器', '洗衣机', '冰箱', '沙发', '宽带', '可做饭']",只为您寻找一个温馨舒适安逸的房间，给您一个家的感觉~1房源真实，全新家具家电，全新全自动洗衣机，给您一个良好舒适的居住环境2小区绿化好，保安24*巡逻，安全可靠3房间南北通透，采光好，视野棒，带独立阳台4免费保洁，免费维修家具家电，免费上网5只租给附近上班的白领或者是刚毕业的大学生，，不租给不三不四混社会的人，不租给酗酒爱吵闹的人6本公司济南各地均有房子，这里不满意，我们免费给您找，期待您的来电让在大城市漂泊的您住进一个幸福的“家”，给您够得着的幸福入住起将配有专业维修售后团队，免去您的生活烦恼，周末尽情嗨！地处成熟商圈，周围菜市场，超市，小吃街等等，SO，无论你是购物狂、吃货、还是夜猫、*宅、统统都满足！服务保障1.租客身份验证，入住更放心2.公共区域定期保洁，居住环境焕然一新
精装修王官庄两室一厅。非常干净。家具家电齐全。拎包入住，急租,2室1厅1卫,整租,70,南,中层 / 6层,市中,王官庄小区(九区),市中王官庄 - 南辛庄西路,1400,无,"['电视', '空调', '热水器', '洗衣机', '冰箱', '床', '沙发', '衣柜', '暖气', '宽带', '可做饭', '阳台']",房屋特征：，装修很好，房主收拾的非常温馨舒适，空调，冰箱，洗衣机全都配齐，周边配套：房子在王官庄，成熟社区，配套设施齐全，生活方便，靠近大众广场，华润超市，菜市场，交通情况：交通便利，102.104.21.29.13.125.K92路等公交车路线经过。
可短租 精装挑空复式 凤凰SOHO 一室一厅 高新万达,1室1厅1卫,整租,60,西,低层 / 18层,高新,凤凰SOHO,高新国际会展中心 - 凤凰路,2000,无,"['电视', '空调', '热水器', '洗衣机', '冰箱', '床', '沙发', '衣柜', '暖气', '宽带', '可做饭', '阳台']",1、位置：高新花园东路和凤凰路口2、户型：复式公寓楼上卧室楼下客厅厨房卫生间3、配套：双人床、床头柜、衣橱、沙发、茶几、电视机电视机柜、冰箱、洗衣机、空调、整体厨房油烟机、整体卫生间热水器等全套家居家电4.有钥匙随时看房随时入住好房5、高新工业南路、奥体中路、奥体中心、高新会展中心、汉峪、齐鲁软件园高新万达广场及凤凰路周边房源都有，需要的客户可以随时联系我。点击我的头像可直接进入我的网络门店查看更好！
殷陈西小区 高新万达公交直达 免费停车 不收取水费,3室2厅2卫,合租 - 主卧,28,南,中层 / 33层,历城,殷陈小区(工业南路),"历城济钢 - 工业南路,近飞跃大道",550,无,"['热水器', '洗衣机', '冰箱', '沙发', '宽带', '可做饭']",间标准配物：床、衣柜、床头橱、写字桌、椅子、空调、冰箱、全自动洗衣机、24热水器、天然气灶台、可做饭房费包含：光纤100兆宽带费、暖气费、物业管理费交费方式：押一付一减少经济压力！房间一房一价！房间朝向采光极好配套齐全精装修！所有照片均为装修后实际拍摄的！您在这个城市里，我不仅帮能您找到舒适的房子！如还需要其他帮助，我会尽我能及的帮助您！介绍：（1）房租押一付一，无中-介-费，公司自营直接出租。（2）居住问题管家报修，接单上门维修。冬有暖气、夏有空调。（3）无线宽带、衣柜、大床(床下超大储物空间)、电脑桌、椅子、晾衣架、空调、24*热水器、暖气、冰箱、全自动洗衣机、电磁炉、全套厨房、天然气可做饭。（4）我们的小区均为成熟小区，下楼就站牌，吃喝玩乐应有尽有（济南各大区都有直达车！）。（5）租客要求：养宠物者不租、不爱干净者不租、斤斤计较者不租、18岁以下及45岁以上者不租！该公寓遍布济南各个区域，欢迎骚扰！
贤文花园南区 紧邻国际会展中心 万达广场 康虹路 交通便利,4室2厅2卫,合租 - 主卧,30,南,高层 / 7层,高新,贤文花园(南区),高新国际会展中心 - 康虹路,850,距离地铁R3号线丁家庄站1575米,"['热水器', '洗衣机', '冰箱', '沙发', '宽带', '可做饭']",一、无中介费、看房费，随时免费看房1、水费电费都是正规居民用电用水费用标准，绝无乱收费现象2、房间照片*真实3、家具齐全，随时拎包入住二、周边环境好1、闹中取静（非常静谧的地方）、居家环境温馨，生活配套设施完善！2、交通便利，出小区门口就是公交站牌；3、周边生活设施齐全，商场、超市、菜市场、银行、学校等应有尽有！4、屋内全新装修，干净整洁
0中介   华福国际 2室1900元月 电梯房 精装修,2室2厅1卫,整租,90,南,低层 / 26层,历城,华福国际,历城小清河 - 北园大街57号,1900,无,"['电视', '空调', '热水器', '洗衣机', '冰箱', '床', '沙发', '衣柜', '暖气', '宽带', '可做饭', '阳台']",餼.房屋南北通透通风良好宽敞明亮布局大方采光非常好龤.精装修房屋干净卫生整洁房屋布置温馨舒适窗明几净家电家具齐全可拎包入住龒.成熟商圈闹中取静周边菜市场超市小吃街娱乐公园医院银行学校运动场所无论你是吃货夜猫子各种宅还是爱逛街运动达人都能满足麣.小区环境优美绿化率高窗外一片好风景好的环境带给您好的心情鑶.交通便利公交地铁BRT直达上班不迟到下班不拥挤鸺.房屋基本配置有床衣柜电脑桌椅子沙发冰箱洗衣机热水器WIFI等閏.多种支付方式年付季付月付皆可龥.有专业保洁定期打扫卫生，让您住的舒适齤.随时看房，全年无休、房间配置：海尔冰箱、海尔洗衣机、美的热水器、双人大床、橱柜、餐桌餐椅、衣柜、电脑桌椅、厨房、厕所、宽带、木地板一应俱全。
