标题,户型,租房方式,房屋大小,房屋朝向,楼层,区县,小区名称,地址,房租,地铁,房屋配置,房屋描述
东八区 世纪大道  奥特莱斯 水发 药谷 火炬东第精装两室,2室2厅1卫,整租,89,南北,高层 / 18层,历城,火炬东第,历城唐冶 - 唐冶西路1177号,1600,无,"['电视', '空调', '热水器', '洗衣机', '冰箱', '床', '沙发', '衣柜', '暖气', '宽带', '可做饭', '阳台']",·精装出租，全套家具家电齐全，拎包即住、省心省时省力1、中心地段，采光好，景观也非常棒！2、房间精装修，非常干净，状态非常好。3、配套：空调，床，衣橱，沙发，冰箱，电视，洗衣机，热水器等家具家电都有，满足日常生活所需.4、生活方利，出行便利，115、158、163、136、301等多路公交车。5、照片仅供参考！如果有兴趣可以给我打电话，带您看一下真实的房子！个人介绍业务范围：和润幸福城、恒大名都、鲁商凤凰城、唐官小区、绿地城、火炬东第、银丰唐郡、华夏帝苑、唐城小区、东岸嘉园、雍景豪庭、保利花园、永大颐和园等租赁与买卖业务！并于周围知名开发商一手房二手房合作，有需要请致电24服务.公共设施齐全，治安稳定，邻里亲善，入住率高，看房随时打电话，您拨进来的电话为虚假号码，不用担心泄露个人信息。
贤文花园南区 会展中心 丁豪广场 万达广场 三庆财富 可月付,4室2厅2卫,合租 - 次卧,18,南,中层 / 29层,高新,贤文花园(南区),高新国际会展中心 - 康虹路,550,距离地铁R3号线丁家庄站1575米,"['热水器', '洗衣机', '冰箱', '沙发', '宽带', '可做饭']","您给我们一个机会——我们给您一个温馨的家!无线宽带、衣柜、大床、电脑桌、晾衣架、空调、24*热水器、暖气、冰箱、洗衣机、厨房可做饭。交通便利,楼下就是公交车站点.直达各大繁华区域,门口小吃城居多,省时吃美食！房间各项基础设配齐全,不*嘘、房间至少干净卫生,每周保洁打扫、师傅上门免费维修.省心小区覆盖：高新区：齐鲁软件园，奥体中心，龙奥大厦，玉兰广场，银丰财富广场，海信龙奥九号，万科金域中心，汉峪金谷，旅游路，经十路，东城逸家，中国重汽1956，舜奥华府，德润天玺，奥林逸城，南湖北湖，凤凰国际，中铁逸都，雅居园，草山岭各小区精装好房源！附近更多雷同房源"
无中介 能月付短租 主卧独卫汉峪金谷舜泰广场  凤凰旅游路,3室2厅2卫,合租 - 主卧,35,南,低层 / 33层,高新,凤凰国际北区,"高新经十路高新段 - 凤凰路,近旅游北路",1050,无,"['电视', '空调', '热水器', '洗衣机', '冰箱', '床', '沙发', '衣柜', '暖气', '宽带', '可做饭', '阳台']",无~中~介~费我们知道您需要什么样的房源，合理的价格，舒适的环境，步行的距离，好相处的室友，当您有问题时随时都能出面解决的专业管家。您需要的的正是我们在努力。房源描述】次卧，实体墙隔音，空调，24h热水，朝阳，采光好。专业售后，专业保洁，室友好相处【房源优势】步行到汉峪金谷，龙奥大厦，附近房源重汽1956，凤凰国际，德润天玺，东城逸家【我们对租客的要求】一，可养小型宠物，二，不讲究公共卫生不租，三，吵闹不租对租客的严格要求，只为大家创造一个更舒适的环境
整租 | 龙湖冠寓 洪家楼商圈 押一付一 精装公寓 无中介,1室0厅1卫,整租,30,南,高层 / 6层,历城,东环国际广场,历城二环东路 - 二环东路3966号,1700,无,"['空调', '热水器', '洗衣机', '冰箱', '床', '衣柜', '宽带']",支付无压力：可押一付一，支持信用卡。重磅特惠：龙湖冠寓花园路店可开具正规票据，可申请政府租房补贴（毕业五年内，本科以下学历500元/月，本科学历700元/月，研究生学历1000元/月，博士学历1500元/月，详情请查看济南市政府发布的相关租房补贴政策。）冠寓是龙湖集团推出的都市青年长租公寓品牌，致力于营造一个舒适、安全、便捷、社群、时尚的空间。打造一个以长租公寓为核心，生活服务多功能在内的多元化社区。1.房屋配套：独立的一室一卫，18-35平，含洗衣机冰箱鞋柜空调WIFI，知名家具家电配套齐全。2.超炫公区：免费使用健身房、台球厅、影音室、会客室、公共厨房餐厅，满足多种生活需求，营造健康积极的社交场所。3.多彩社群：每月至少2次社群活动，蹦床、K歌、爬山、轰趴、狼人杀谁是卧底剧本杀、龙虾宴、音乐节、真人CS、聚餐等等，活动不断，更亲密的邻里关系，更自在的志同道合，95后运营官带你体验精彩生活。4.服务：95后年轻运营官、保安、保洁、维修齐全，24H无缝隙守护租户生活。5.交通、车位：龙湖冠寓花园路门店位于花园路二环东路交叉口环联小商品市场东侧，公交便利，楼下就有停车场，停车方便。6.安全可靠：龙湖集团全国36所城市直营，品牌保障，冠寓有店长、运营官、龙湖物业24h无缝隙守护您的安全，且冠寓出入需要梯控、指纹识别、房间有智能密码锁、公共区域有摄像头监控，多维度保障您的的安全，让我们的每一位租户在冠寓都住的安心。7.周边配套：公寓自带自动售卖机、小电充电宝、农夫山泉、充电桩、公共洗衣机等，日常生活便捷。1公里内有印象城、银座、大润发、环联小商品市场、百花公园、中行农行建行工行、漱玉平民大药房等配套设施；3公里内有山大二院、中心医院等三甲医院。生活配套非常健全，能够解决租户一站式生活需求。8.智慧生活智能APP三重智能管理，安心舒心。自主研发“冠寓”APP，轻松实现掌上生活缴费（水电）、线上看房、智能门锁密码管理、故障报销、租约管理等智能化服务。
实图实价无中介！西市场 省立医院附近保利中心精装家具家电齐全,1室1厅1卫,整租,45,南,中层 / 28层,槐荫,保利中心,槐荫西市场 - 经一路333号,1899,无,"['电视', '空调', '热水器', '洗衣机', '冰箱', '床', '沙发', '衣柜', '暖气', '宽带', '可做饭', '阳台']",1.无中介，个人房源，地理位置好2.实图实价，全新家具家电，拎包入住3.押一付一押一付三，半年付，年付都可以，多付优惠4.好房不多，有需要请电话联系
特价！特价！超大房间 采光特好 御华嘉苑 汇隆广场 汇源大厦,3室2厅2卫,合租 - 主卧,22,南,中层 / 12层,历城,御华嘉苑,历城七里河 - 华能路1号,550,距离地铁R3号线花园东路站1777米,"['热水器', '洗衣机', '冰箱', '宽带', '可做饭']","本人将为您提供专业、周全、可靠、安心的服务1、看房，只需您的一个电话，本人24手机不关机2、价格，我将会给您一个满意的答复3、选房，我将会是您的第二双眼睛4、保证，我们公司提供的合同是完整的5、保障，我们的售后服务是让您省心的。房源介绍：1、家电家具均有,直接，保证卫生干净、整洁。2、设备齐全，拎包即可入住3、适合情侣或居家，附近上班人员居住4、小区拥有物业管理停车比较方便5、周边有超市小吃店周边生活配套设施齐全完善6、也许观望等待许久的您在已厌倦看房的时候，突然发现此房后将是另一番想法7、您可以拨打我的电话，我将竭诚为您服务8、有关于房产类的问题，我将"
押一付一 华福国际壹号院 荣盛时代 大润发 精装单间 包网物,3室2厅2卫,合租 - 主卧,19,南,中层 / 30层,历城,华福国际壹号院,历城全福 - 北园大街47-2号,600,无,"['热水器', '洗衣机', '冰箱', '沙发', '宽带', '可做饭']",不是你没有遇到你称心如意的房子，而是没有遇到为你全力以赴的房产经纪人，选择我—-点击我的头像，进入我的店铺更多房源已为准备好房源描述：1、房屋清爽，采光很好！2、交通方便，临近地铁一号线紫庐站塘西河路3、小区周围有国购购物中心银行：各家银行都有营业部分布在小区四周。其他配备：网咖、鲜果吧、便利店、药店等。小区有专门物业部门和门卫让您有一个安全舒适的生活环境需要看房可以联系我约时间如若看不中也没关系，本人手上房源很多，可以提供更多的
特价三天小清河南路 将军路 黄台茶叶市场 荣盛时代 石墙单间,3室1厅1卫,合租 - 主卧,20,南,中层 / 35层,历城,荣盛时代首府,"历城全福 - 北园大街,近将军路辅路",600,无,"['热水器', '洗衣机', '冰箱', '沙发', '宽带', '可做饭']",以上价格为房间定金。我家的房子均以合租单间的形式出租，一户一门，一室一锁。为了生活，为了梦想，在繁多的工作，忙碌的奔波，一身疲惫之后，是否期待一个舒适的小窝？直租0省心省钱晨曦相伴晚霞入睡民用水电陪你度过炙热的夏天，温暖你度过寒冷的冬天。【没有中介】：我们坚持无中介，随时免费带你看房。【押一付一】：房租可灵活支付，月付，半年付，年付都可以。月付押一付一，房租无压力【家电齐全】：全新家具，品牌家电，冰箱，空调，洗衣机等应有尽有，洗澡做饭都很方便。【品质装修】：知名计师匠心打造时尚北欧风、现代简约风，美式田园风等多种风格公寓。【入住保洁】：入住前深度保洁，做到拎包就能入住。【免费维修】：家具家电及时上门维修，随时可预约。【交通便利】：房源紧邻地铁公交，方便出行。【周边设施】：各大商超、美食环绕其中，生活设施便利，吃喝玩乐，应有尽有。众多房源任你选择，只要你有租房需求，就欢迎来电，我会用心给您推荐适合您的房子。品质租房，从一个电话开始
首租 精装修 女生合租 家具齐全 随时看房 靠近华联夜市,3室2厅2卫,合租 - 主卧,25,南,高层 / 12层,历城,大地锐城,历城七里河 - 华能路38号,800,无,"['热水器', '洗衣机', '冰箱', '沙发', '宽带', '可做饭']",精装单间公寓~价位500-1500我们的宗旨：打造济南市*的高品质租住！我们的服务1、付款方式多样化：押一付一压一付二压一付三半年付年付2、公区厨房、卫生间、走廊，不定期免费保洁。3、管家服务:看房选房、签订合同、入住搬家、房间物品非人为损坏无偿维修。4丶随时看房。5丶水费电费都是正规居民用电用水费用标准，绝无乱收费现象。6丶家具齐全，随时拎包入住、周边环境好。7丶闹中取静（非常静谧的地方），居家环境温馨，生活配套设施完善！8丶交通便利，出小区门口就是公交站牌；9丶周边生活设施齐全，商场、超市、菜市场、银行、学校等应有尽有！
紧邻万达广场 茗筑美嘉 盛世花城 新生活家园 地暖双气 月付,3室2厅1卫,合租 - 主卧,20,南,中层 / 26层,高新,茗筑美嘉,高新国际会展中心 - 康虹路769号,886,无,"['热水器', '洗衣机', '冰箱', '沙发', '宽带', '可做饭']",首先承诺！！！我们不是中介，没有中介费，租房找我，价格500到1500都有，尽心满足您的所有租房要求！房源优势：押一付一，三个月起租，价格优惠。南向主卧，带阳台，精装修，空间大，照片真实价格，包物业、宽带、水电、保洁，一户一表，用电量APP可查，电费清晰，无杂费，不乱收费用，无中介费。1、精装修，实惠单间，价格美丽。2、免费看房用我们的耐心满足挑剔的您。3、在租房源，多为成熟小区，附近交通便利，生活设施齐全，超市、菜市场、夜市附近都有满足您的生活、娱乐要求。4、当然，我们对租客也是有要求的，禁止养宠物，没有正当职业的人不租，让你的合租生活’更加的贴心舒适。5、每固定时间，公区保洁，房间干净卫生，居住空间合理、采光好，满足挑剔的您。6、无线WIFI、智能家电、空调、洗衣机、24热水器，居住起来更加的舒适便捷。7、多套房源可供选择，我们在力高国际、泰悦赫府、保利华庭、丰奥嘉园、茗筑美嘉、翡翠大观、盛景家园、新馨家园、贤文花园、徐家庄、大地锐城、新龙家园、逸东花园、富翔天地、凯旋花园、辛甸花园、七里堡小区、保利海德公馆、盛世花城、万达华府、新生活家园、杏林苑、祝甸东方花园、环东佳苑、锦绣泉城、鑫苑鑫、上海花园、七里河小区，等多个小区都有合租房源满足您的租住要求。8、多间空置在租价格300—1800都有，无看房费，无中介费！！！需要的请联系我！！！
高新万达旁，牛旺小区，3户合租，有电梯，美莲广场，未来城旁,3室1厅1卫,合租 - 主卧 - 男女不限,30,南,中层 / 18层,高新,牛旺庄小区,高新国际会展中心 - 沁园路1599号,700,无,"['空调', '热水器', '洗衣机', '冰箱', '床', '衣柜', '暖气', '宽带', '可做饭', '阳台']",.不说装修多好，至少干净卫生，清净明亮。2.不像别的房居住人多且杂，合租五六间甚至更多，品牌只为专属的你。3.小区*，出门公交，闹中取静，成熟商圈，周边菜市场，超市，小吃街，无论你是购物狂，吃货，夜猫子，技术宅都能满足。4.公司自己的房子，不是骗人，真的不收*。5.服务周到，带你看遍济南商圈所有*，相信我，成就你。6.无线宽带、衣柜、大床、电脑桌、晾衣架、空调、24*热水器、暖气、冰箱、洗衣机、全套厨房可做饭房屋亮点押一付一精装修1.精装拎包入住标配床衣柜电脑桌空调洗衣机热水器WiFi全覆盖2.随时看房3.公寓的公共区及卫生间每周保洁无垃圾死角舒适干净4.配备专业的后勤维修与保洁队伍，免去您的后顾之忧出租范围：万达华府、盛世花城、未来城、鑫苑国际、明湖白鹭郡、明湖太学院、牛旺庄、聚鑫旺园、新生活家园、会展中心、海信贤文世家、山钢新天地、中垠雅苑、中海天悦府、燕山新居、绿地IFC、现代逸城、雁翔苑、百花郡、华丰居、名士豪庭、窑头小区、高速花园、富翔天地、中铁逸都国际、北湖、万科金域华府、恒大奥东新都、东城花园、徐家庄、殷陈小区、中建新悦城、恒大城、东都尚城、龙翔华府、盛景家园、盛福家园、尚品燕园、七里河小区、玫瑰花园、百花小区、百花郡、祥泰森林河湾、淮海东城御景交通干线：工业南路、经十路、花园东路、奥体中路、奥体西路、奥体东路、奥体北路、旅游路、凤凰路、舜华路、舜风路、天辰路、康虹路、铁骑路、世纪大道、凤园路、龙鼎大道、会展路、新泺大街、天泺路、浪潮路、伯乐路、舜泰北路、凤鸣路、凤岐路、工业北路、飞跃大道、颖秀路、沁园路、舜旺路、会展东路、会展西路、金达路、华茂路、龙奥北路、龙奥南路、凤新路、华盛路、百合东路、老石沟路、龙驰路、重德路、礼耕路、齐川路、正丰路、轻风路、中林路、八涧堡东路、八涧堡路、炼化路、凤山路
鲁商凤凰广场药谷博科水发集团企业公馆唐冶中路鲁商凤凰城单间,3室2厅2卫,合租 - 次卧,25,南,低层 / 34层,历城,鲁商凤凰广场,历城唐冶 - 唐冶中路,650,无,"['热水器', '洗衣机', '沙发', '宽带', '可做饭']",房屋推荐特点：龒、户型特点：中高层、户型方正、采光视野好，适宜居住。龤、室内精装修，拎包入住，宽敞大方，使用率高；卧室温馨舒适，搭配心怡，厨房设施齐全。驋、环境优雅，低密度社区，小区绿化率高，让你每天生活在空气清新的环境下。餼、小区地理位置好，位于商业圈，交通便利，出小区就是站牌，小区周边配套设施齐全，银行、超市、菜市、学校、医院、商务会所，应有尽有。小区环境幽雅，绿化面积大，家里家室家电齐全，可带衣物直接入住！看房方便，提前预约！
精装大两室家具家电齐全 拎包入住 紧邻欧亚大观和谐广场,2室1厅1卫,整租,89,南北,中层 / 33层,槐荫,阳光100国际新城T区,槐荫阳光100 - 建新路,2500,无,"['电视', '空调', '热水器', '洗衣机', '冰箱', '床', '沙发', '衣柜', '暖气', '宽带', '可做饭', '阳台']",生活设施配套齐全人文素质极高封闭式小区人身安全有保障
政府宿舍(姚家)出租精装修  附近山东省武术院 齐鲁工业大学,3室1厅1卫,整租,85.31,南北,高层 / 6层,历下,政府宿舍(姚家),历下姚家 - 解放东路83号,2199,无,"['电视', '空调', '热水器', '洗衣机', '冰箱', '床', '沙发', '衣柜', '暖气', '可做饭', '阳台']",【格局】3室1厅1卫，采光好，视野无遮挡。【价格】租金2199元/月【装修】房子居家精装，保养全新【图片为本房图片】【看房】24随时。公交：18路、62路、504路、k53路（武警医院站），18路、504路、62路、k53路（姚家小区站），306路、k145路、152路、202路工作日高峰车、119路、k160路、brt5路、k139路、115路、326路、504路（华洋名苑站）大学：审计学校、环保学校、建筑工程学校、山东大学南校区、山东经济学院、山东旅游学院、山东政法学院商场：银座燕山店、万嘉隆购物广场、燕山小商品市场、统一银座、甸柳吉祥商业街医院：妇产医院、省中医药研究附属医院、甲状腺疾病防治中心、武警总队医院、省立医院东院邮局：开元邮电支局、姚家邮电支局银行：农村信用社、农业银行、中国银行、建设银行、工商银行、中兴银行、齐鲁银行、兴业银行、渤海银行其他：世纪人和商务酒店、富雅大酒店、聚福林海鲜城、威海海鲜城、巴山蜀乡小区内部配套：小区内有免费停车位、娱乐健身设施、小餐馆、便利店
东山墅 精装修 189平 4室2厅2卫 价格可议,4室2厅2卫,整租,189,南北,低层 / 6层,历下,东山墅,历下历下周边 - 旅游路7号,6000,无,"['空调', '热水器', '衣柜', '暖气', '可做饭', '阳台']",1.四室两厅两卫2.房屋干净整洁，光照充足，可直接拎包入住。3.房屋精装修，厨房可做饭，4.随时入住
新出中海天悦府精装两室 就一套 速度联系 美莲软件园丁豪银荷,2室2厅1卫,整租,90,南北,低层 / 24层,高新,中海天悦府(北区),高新齐鲁软件园 - 舜风路700号,3000,无,"['电视', '空调', '热水器', '洗衣机', '冰箱', '床', '沙发', '衣柜', '暖气', '宽带', '可做饭', '阳台']",龒.房源真实，南北通透，房屋宽敞，干净卫生，采光好，视野棒。免费wifi，家具家电等基本设施齐全，随时拎包入住，给您一个方便温馨舒适的居住环境。驋.房屋人员问题：为了营造干净、温馨、和谐、安全的居住环境，租客都是有素质的上班族，公司绝不租给不三不四，生活无规律，无正当职业，大吵大闹的租客。餼，可押一付一或押一付三，付-款方式灵活，解决您的资金紧张问题。龤.免费保洁，免费维修家具家电，配有专业维修后勤团队，免去生活烦恼。閏.小区介绍：地处成熟商圈，周围菜市场，超市，饭店，小吃街，银行，娱乐场所等生活设施一应俱全。小区绿化环境好，保安驋龤巡逻，居住安全可靠。服务保障：龒.入住安全放心有保障。驋.公共区域定期保洁，居住环境好。餼.我们在济南各地均有房源，只要您一个电话，我们风里雨里免费带您看房。让您在这个城市找到一个属于自己的温馨小窝。更多房源等你来挑
双气齐全！和谐佳苑 和谐广场 银座写字楼 连城广场 无中芥,3室2厅2卫,合租 - 主卧,25,南,中层 / 22层,槐荫,和谐佳苑,槐荫和谐广场 - 阳光新路,600,无,"['热水器', '洗衣机', '冰箱', '沙发', '宽带', '可做饭']",1.小区周边配套丰富，饭店，超市，生活十分便利！地理位置优越交通便利，多路公交经过家门口，附近公交车交通便捷！2.家里有床、衣柜，桌子椅子，空调等家具一应俱全3.有厨房，可以做饭4.房源价格低廉5免费上门维修6.客服定期检查卫生，排除电路水路等安全隐患7.租赁期间如有各项问题，我们客服为您排解解难协调调解重要的是无-中-介-费！！！温馨提示养宠物的、没有正当职业的、不爱干净的、大吵大闹的，为了营造干净、和谐、安全的居住环境，以上租客不租若您觉得此房源不能满足您的需求，本人拥有区域所有在租房源，欢迎点击我的主页，里面有更多的真实照片及价格的房源供您挑选，直到您满意
新上房源 南向 真实在租 业主急租年前租出去 价格低 户型好,2室1厅1卫,整租,75,南,中层 / 31层,高新,汇展香格里拉,高新国际会展中心 - 新宇路1号,1750,距离地铁R3号线丁家庄站1984米,"['电视', '空调', '热水器', '洗衣机', '冰箱', '床', '沙发', '衣柜', '暖气', '宽带', '可做饭', '阳台']","房屋介绍一、房屋基本信息：1、楼盘名称：汇展香格里拉2、房屋性质:住宅3、装修情况:精装修、客厅瓷砖,卧室瓷砖4、配套情况：各种家电一应俱全，拎包即可入住。5、腾房情况：房屋现在空置,干净整洁，随时入住。二、小区配套：1、附近万达广场、银座超市、菜市场等生活便利。2、交通方便：多路公交直达三、个人介绍:本人从事房地产行业多年,主高新商圈，对周边房源均有了解。如果您有任何房产方面的需求,欢迎致电,我将竭诚为您服务。"
东方天澍花园精装两室家具齐全，拎包入住，毗邻CBD，辅仁小学,2室2厅1卫,整租,90,南,高层 / 24层,历下,东方天澍花园,历下浆水泉路 - 洪山路1号,4000,无,"['空调', '热水器', '洗衣机', '冰箱', '床', '沙发', '衣柜', '暖气']",增加start房屋亮点防疫服务特殊展示带hover配套齐全精装修有阳台随时看房出租要求一年起租房源描述房子位于经十路以南旅游路以北洪山路！交通便利！生活丰富！1、小区物业：治安好，环境好，干净整洁卫生，风景这边独好；2、生活方便：附近就有早市、下井菜市场、满足您基本的生活需求，附近紧靠银座商城、华联超市、大润发等；3、上学方便：山大辅仁、山东财经大学燕山校区；4、交通方便：附近就有公交站牌，出行方便；6、周边配套：银行有建设银行，中国银行，中国农业银行，邮政，医院有武警医院，山东妇产医院等；7、房子楼层：房间精装修，
省立医院西CBD精装两室中国铁建国际城燕山新居奥体西路,2室2厅1卫,整租,96,南,高层 / 30层,历下,中国铁建国际城,历下解放东路 - 奥体西路北段2666号,3300,距离地铁R3号线礼耕路站582米,"['电视', '空调', '热水器', '洗衣机', '冰箱', '床', '沙发', '衣柜', '暖气', '可做饭', '阳台']",1、楼盘名称：中国铁建国际城2、房屋性质：住宅3、装修情况：精装修、客厅、卧室地板4、配套情况：床、冰箱、洗衣机等家具齐全5、物业费用：1.8元带电梯6、腾房情况：房屋现在空置，干净整洁，拎包入住7、看房时间：随时看房二：小区配套：1、附近万达广场、银座超市、菜市场等生活便利2、交通方便：多路公交直达3、多所幼儿园解决入托问题，接送方便
山大路172号院出租精装 附近华强广场 银座数码广场拎包入住,3室1厅1卫,合租 - 主卧,25,南北,高层 / 6层,历下,山大路172号院,历下泉城路 - 山大路172号,999,无,"['热水器', '洗衣机', '冰箱', '沙发', '宽带', '可做饭']","【格局】山大路172号院出租主卧3室1厅1卫，采光好，视野无遮挡。【价格】租金999元/月【装修】房子居家精装，保养全新【图片为本房图片】【看房】24随时。公交：70路,k55路(舜怡佳园站)；113路,165路,37路,3路,45路,507路,79路,83路,8路,brt2路,brt3路,k53路,k55路,k91路(东仓站)；112路,16路,1路,48路(山大路山大南路站)大学：山东大学、铁道职业技术学院山东大学、山东师范大学、山东教育学院、山东建筑大学、商职、法官学院商场：银座商场、大润发、数码港、百脑汇、家乐福、银座数码广场、华强商城医院：中心医院、荣军医院、济南医院、济南胸科医院邮局：山大路邮电局、山大南路邮电局银行：工商银行、中国银行、农业银行、建设银行、商业银行、民生银行其他：泉城广场、洪楼广场、大明湖、百花公园小区内部配套：停车位、便利店、小餐馆、娱乐健身设施"
